Titre du poste,Entreprise,Ville,Secteur,Contrat proposé,Niveau d'étude,Expérience,Compétences Techniques,Langues,Soft Skills,Lien de l'offre
ADM Value agrandit ses équipes à Rabat: découvrez nos offres en télévente et conseil,Non spécifié,Rabat,"Automobile, Énergie",CDI,Non spécifié,20 ans,Non spécifié,Français,"Autonomie, Communication, Organisation, Relationnel, Rigueur, Réactivité",https://www.dreamjob.ma/emploi/adm-value-recrute-plusieurs-profils/
Fondation Arrawaj recrute Plusieurs Profils (Tout le Maroc),Fondation Arrawaj,Non spécifié,Non spécifié,CDI,Bac+3,30 ans,Non spécifié,Non specifié,"Autonomie, Communication, Initiative, Leadership, Organisation, Rigueur",https://www.dreamjob.ma/emploi/fondation-arrawaj-recrute-plusieurs-profils-tout-le-maroc/
Société de Construction Routière recrute un Responsable Matériel BTP à Salé,Société de Construction Routière,Salé,"Btp, Construction, Logistique",Non spécifié,Bac+5,5 ans,Non spécifié,Non specifié,Organisation,https://www.dreamjob.ma/emploi/societe-de-construction-routiere-recrute-un-responsable-materiel-btp-a-sale/
Université Euromed de Fès recrute 16 nouveaux profils,Université Euromed de Fès,Fès,"Chimie, Recherche scientifique",Non spécifié,Non spécifié,Non spécifié,Non spécifié,Non specifié,Innovation,https://www.dreamjob.ma/emploi/universite-euromed-de-fes-recrute-16-nouveaux-profils/
Recrutement de Rédacteurs Web Freelance en Télétravail,Non spécifié,Non spécifié,Non spécifié,Non spécifié,Non spécifié,Non spécifié,Non spécifié,"Français, Anglais",Flexibilité,https://www.dreamjob.ma/emploi/start-up-recrute-des-redacteurs-web-freelance-en-teletravail/
4 opportunités à saisir chez Mandarin Oriental Marrakech,Non spécifié,Marrakech,Non spécifié,Non spécifié,Non spécifié,2 à 3 ans,"Excel, GMAO, Ms project","Français, Anglais, Arabe","Autonomie, Communication, Leadership, Organisation, Rigueur",https://www.dreamjob.ma/emploi/4-opportunites-a-saisir-chez-mandarin-oriental-marrakech/
Postes à saisir chez G3C à Casablanca,Non spécifié,Casablanca,"Btp, Construction, Logistique",CDI,Non spécifié,5 ans,Non spécifié,Non specifié,"Organisation, Relationnel, Rigueur",https://www.dreamjob.ma/emploi/postes-a-saisir-chez-g3c-a-casablanca/
"Bosch recrute en data, finance et commerce",Bosch,Casablanca,Non spécifié,Stage,Non spécifié,1 an,"ERP, Excel, Python, SAP, SQL","Français, Anglais, Arabe","Autonomie, Communication, Innovation, Organisation, Proactivité, Rigueur",https://www.dreamjob.ma/emploi/bosch-recrute-en-data-finance-et-commerce/
La Centrale Automobile Chérifienne propose 10 postes à saisir,Non spécifié,Dar Bouazza,Automobile,CDI,"Bac+4, bac+5",9 ans,"ERP, Excel, Modélisation, Python, SQL","Français, Anglais, Arabe","Autonomie, Communication, Force de proposition, Gestion de projet, Leadership, Organisation, Rigueur, Travail en équipe",https://www.dreamjob.ma/emploi/la-centrale-automobile-cherifienne-propose-10-postes-a-saisir/
Opportunités de carrière chez Airbus Atlantic Maroc,Non spécifié,Casablanca,"Automobile, Aéronautique, Logistique",Non spécifié,Bac+5,2 ans,"APQP, Excel, SAP","Français, Anglais","Communication, Innovation, Organisation",https://www.dreamjob.ma/emploi/opportunites-de-carriere-chez-airbus-atlantic-maroc/
"Safran lance un recrutement en maintenance, comptabilité et IT",Non spécifié,Casablanca,Aéronautique,CDI,Bac+5,10 ans,"ERP, Excel, SAP",Anglais,"Initiative, Innovation, Leadership, Proactivité, Relationnel, Rigueur, Travailler en équipe",https://www.dreamjob.ma/emploi/safran-lance-un-recrutement-en-maintenance-comptabilite-et-it/
TE Connectivity recrute 6 profils à Tanger,TE Connectivity,Tanger,"Logistique, Procédés, Énergie",Non spécifié,"Bac+2, bac+3, bac+5",2 ans,"Automatisme, CATIA, Creo, ERP, Excel, Lean, Lean manufacturing, SAP, SOLIDWORKS, Six sigma","Français, Anglais",Travail en équipe,https://www.dreamjob.ma/emploi/te-connectivity-recrute-6-profils-a-tanger/
6 Opportunités de carrière ouvertes chez TotalEnergies,Non spécifié,Tanger,Énergie,CDI,"Bac+2, bac+3, bac+5",3 ans,"Automatisme, Excel",Français,"Communication, Innovation, Organisation, Polyvalence",https://www.dreamjob.ma/emploi/6-opportunites-de-carriere-ouvertes-chez-totalenergies/
3 opportunités d’emploi disponibles chez SCIF à Casablanca,Non spécifié,Casablanca,"Construction, Ferroviaire",CDI,"Bac+2, bac+5",4 ans,"Autocad, ERP, SOLIDWORKS",Anglais,"Relationnel, Rigueur",https://www.dreamjob.ma/emploi/3-opportunites-demploi-disponibles-chez-scif-a-casablanca/
Plusieurs responsables recherchés chez VINCI Energies au Maroc,Non spécifié,Non spécifié,Logistique,Non spécifié,"Bac+4, bac+5",2 à 3 ans,"GMAO, Python",Non specifié,"Autonomie, Innovation, Organisation, Relationnel",https://www.dreamjob.ma/emploi/plusieurs-responsables-recherches-chez-vinci-energies-au-maroc/
Opportunités à saisir chez Structural Aerospace Morocco,Non spécifié,Nouaceur,"Aéronautique, Logistique",Intérim,Non spécifié,0 à 2 ans,Non spécifié,Anglais,"Autonomie, Relationnel, Rigueur",https://www.dreamjob.ma/emploi/opportunites-a-saisir-chez-structural-aerospace-morocco/
7 Opportunités disponibles chez Air Arabia à Casablanca et Tanger,Non spécifié,Casablanca,Aéronautique,Non spécifié,"Bac+2, bac+3, bac+5",2 ans,Non spécifié,"Français, Anglais, Arabe","Communication, Résolution de problèmes",https://www.dreamjob.ma/emploi/7-opportunites-disponibles-chez-air-arabia-a-casablanca-et-tanger/
Postes à saisir chez Aiguebelle dans l’industrie,Non spécifié,Casablanca,"Logistique, Procédés",CDI,Bac+2,2 à 5 ans,Non spécifié,"Français, Anglais","Communication, Gestion de projet, Leadership, Organisation, Travail en équipe",https://www.dreamjob.ma/emploi/postes-a-saisir-chez-aiguebelle-dans-lindustrie/
Nouvelles opportunités professionnelles chez Mafoder Group,Non spécifié,Non spécifié,"Btp, Construction",Non spécifié,Non spécifié,10 ans,Non spécifié,Non specifié,Rigueur,https://www.dreamjob.ma/emploi/nouvelles-opportunites-professionnelles-chez-mafoder-group-2/
ENI Group lance une grande campagne de recrutement au Maroc,Non spécifié,Non spécifié,"Logistique, Plasturgie, Procédés",CDI,"Bac+2, bac+3, bac+4, bac+5",35 ans,"Automatisme, CATIA, Excel, GMAO, SOLIDWORKS","Français, Anglais","Autonome, Autonomie, Relationnel, Rigueur, Réactivité, Travailler en équipe",https://www.dreamjob.ma/emploi/eni-group-lance-une-grande-campagne-de-recrutement-au-maroc/
Concours de Recrutement SRM Casablanca-Settat 2026 (+1000 Postes),Non spécifié,Casablanca,Non spécifié,CDI,Non spécifié,Non spécifié,Non spécifié,Non specifié,Travailler en équipe,https://www.dreamjob.ma/emploi-public/concours-de-recrutement-srm-casablanca-settat-2026-1000-postes/
INGELEC recrute 9 profils à Casablanca,INGELEC,Casablanca,"Logistique, Plasturgie",CDI,Non spécifié,Non spécifié,Non spécifié,Non specifié,"Communication, Organisation, Organisé, Relationnel, Rigueur, Résolution de problèmes",https://www.dreamjob.ma/emploi/ingelec-recrute-9-profils-a-casablanca/
SEGULA embauche dans l’aéronautique pour des postes au Québec,Non spécifié,Non spécifié,Aéronautique,Non spécifié,Non spécifié,5 ans,Non spécifié,"Français, Anglais","Autonomie, Innovation, Rigueur",https://www.dreamjob.ma/emploi-international/segula-embauche-dans-laeronautique-pour-des-postes-au-quebec/
SEBN Maroc recrute plusieurs profils industriels dès maintenant,SEBN Maroc,Salé,"Automobile, Logistique",Non spécifié,"Bac+2, bac+3, bac+5",7 ans,Non spécifié,Non specifié,"Leadership, Rigueur",https://www.dreamjob.ma/emploi/sebn-maroc-recrute-plusieurs-profils-industriels-des-maintenant/
"Recrutement APM Terminals, profils qualifiés recherchés",Non spécifié,Tanger,Logistique,Non spécifié,Non spécifié,5 ans,"Automatisme, Lean",Anglais,"Communication, Leadership",https://www.dreamjob.ma/emploi/recrutement-apm-terminals-profils-qualifies-recherches/
Mint HR recrute un(e) Chargé(e) de Recrutement (CDI) – Casablanca,Mint HR,Casablanca,Non spécifié,CDI,"Bac+3, bac+5",Non spécifié,Non spécifié,Non specifié,"Autonomie, Communication, Organisation, Relationnel, Rigueur",https://www.dreamjob.ma/emploi/mint-hr-recrute-une-chargee-de-recrutement-cdi-casablanca/
Magasin d’Optique recrute une Vendeuse (Wifak Témara),Magasin d’Optique,Témara,Non spécifié,Non spécifié,Non spécifié,Non spécifié,Non spécifié,Non specifié,"Autonome, Communication, Organisation, Organisé, Proactivité, Rigueur, Travailler en équipe",https://www.dreamjob.ma/emploi/optique-recrute-une-vendeuse-sur-wifak-temara/
"Solevio recrute des Vendeurs Conventionnels CHR (Cafés, Hôtels, Restaurants) (Casablanca)",Solevio,Casablanca,Agroalimentaire,Non spécifié,Bac+2,3 ans,Non spécifié,Non specifié,Non spécifié,https://www.dreamjob.ma/emploi/solevio-recrute-vendeurs-conventionnels-chr-casablanca/
Grande campagne de recrutement Calliope: plusieurs postes à saisir partout au Maroc,Non spécifié,Non spécifié,"Automobile, Logistique",Stage,"Bac+2, bac+3, bac+4, bac+5",3 à 5 ans,Excel,"Français, Anglais, Arabe","Autonomie, Communication, Créativité, Gestion de projet, Initiative, Innovation, Leadership, Organisation, Relationnel, Rigueur, Réactivité, Travailler en équipe",https://www.dreamjob.ma/emploi/grande-campagne-de-recrutement-calliope-plusieurs-postes-a-saisir-partout-au-maroc/
Recrutement d’un Responsable des Opérations (Rabat),Non spécifié,Rabat,Non spécifié,CDI,Non spécifié,Non spécifié,Non spécifié,Non specifié,"Organisation, Relationnel, Rigueur",https://www.dreamjob.ma/emploi/recrutement-dun-responsable-des-operations-rabat/
Juriste Junior,Non spécifié,Non spécifié,Non spécifié,CDI,Bac+5,Non spécifié,Non spécifié,"Français, Anglais","Communication, Organisation, Rigueur",https://www.dreamjob.ma/stage/minthr-recrute-juriste-junior-stage-casablanca/
ADM Value agrandit ses équipes à Rabat: découvrez nos offres en télévente et conseil,Non spécifié,Rabat,"Automobile, Énergie",CDI,Non spécifié,20 ans,Non spécifié,Français,"Autonomie, Communication, Organisation, Relationnel, Rigueur, Réactivité",https://www.dreamjob.ma/emploi/adm-value-recrute-plusieurs-profils/
Fondation Arrawaj recrute Plusieurs Profils (Tout le Maroc),Fondation Arrawaj,Non spécifié,Non spécifié,CDI,Bac+3,30 ans,Non spécifié,Non specifié,"Autonomie, Communication, Initiative, Leadership, Organisation, Rigueur",https://www.dreamjob.ma/emploi/fondation-arrawaj-recrute-plusieurs-profils-tout-le-maroc/
Société de Construction Routière recrute un Responsable Matériel BTP à Salé,Société de Construction Routière,Salé,"Btp, Construction, Logistique",Non spécifié,Bac+5,5 ans,Non spécifié,Non specifié,Organisation,https://www.dreamjob.ma/emploi/societe-de-construction-routiere-recrute-un-responsable-materiel-btp-a-sale/
Université Euromed de Fès recrute 16 nouveaux profils,Université Euromed de Fès,Fès,"Chimie, Recherche scientifique",Non spécifié,Non spécifié,Non spécifié,Non spécifié,Non specifié,Innovation,https://www.dreamjob.ma/emploi/universite-euromed-de-fes-recrute-16-nouveaux-profils/
Recrutement de Rédacteurs Web Freelance en Télétravail,Non spécifié,Non spécifié,Non spécifié,Non spécifié,Non spécifié,Non spécifié,Non spécifié,"Français, Anglais",Flexibilité,https://www.dreamjob.ma/emploi/start-up-recrute-des-redacteurs-web-freelance-en-teletravail/
Atlas Defense ouvre plusieurs postes à Benslimane,Atlas Defense,Non spécifié,"Aéronautique, Logistique",CDI,Non spécifié,5 ans,"ERP, Excel","Français, Anglais",Leadership,https://www.dreamjob.ma/emploi/atlas-defense-ouvre-plusieurs-postes-a-benslimane/
5 postes ouverts chez Mafoder Group dès maintenant,Non spécifié,Casablanca,Btp,Non spécifié,Bac+5,Non spécifié,Automatisme,Non specifié,"Organisation, Rigueur",https://www.dreamjob.ma/emploi/5-postes-ouverts-chez-mafoder-group-des-maintenant/
6 postes ouverts chez Valeo à tanger,Non spécifié,Tanger,Automobile,CDI,"Bac+2, bac+5",2 ans,"5S, Lean, SAP",Anglais,"Autonome, Communication, Organisation, Rigueur",https://www.dreamjob.ma/a-la-une/6-postes-ouverts-chez-valeo-a-tanger/
5 opportunités de carrière chez Aiguebelle à pourvoir,Non spécifié,Non spécifié,"Agroalimentaire, Procédés",CDI,Bac+3,Non spécifié,Excel,Non specifié,"Leadership, Organisation, Rigueur, Travailler en équipe",https://www.dreamjob.ma/emploi/5-opportunites-de-carriere-chez-aiguebelle-a-pourvoir/
De nombreuses opportunités chez Mafoder Group à saisir,Non spécifié,Casablanca,Btp,CDI,"Bac+2, bac+3, bac+5",9 ans,"ERP, SQL","Français, Arabe","Autonome, Autonomie, Force de proposition, Relationnel, Rigueur",https://www.dreamjob.ma/emploi/de-nombreuses-opportunites-chez-mafoder-group-a-saisir/
"Nouvelle opportunité à Tanger, 5 postes à saisir chez Aptiv",Non spécifié,Tanger,"Automobile, Logistique",CDI,Bac+5,3 à 5 ans,"AMDEC, CAO, Excel, SAP","Français, Anglais","Communication, Gestion de projet",https://www.dreamjob.ma/emploi/nouvelle-opportunite-a-tanger-5-postes-a-saisir-chez-aptiv/
SCIF ouvre des postes de techniciens spécialisés à Ain Sebaa,SCIF,Casablanca,"Construction, Procédés",CDI,Non spécifié,2 ans,ERP,Non specifié,"Organisation, Rigueur",https://www.dreamjob.ma/emploi/scif-ouvre-des-postes-de-techniciens-specialises-a-ain-sebaa/
TE Connectivity recherche 5 nouveaux profils à tanger,Non spécifié,Tanger,"Automobile, Logistique, Plasturgie, Énergie",CDI,"Bac+2, bac+3, bac+5",2 ans,"5S, ERP, SAP",Non specifié,Non spécifié,https://www.dreamjob.ma/emploi/te-connectivity-recherche-5-nouveaux-profils-a-tanger/
Tractafric lance un stage en RH et un poste Senior,Non spécifié,Casablanca,"Construction, Minier, Énergie",CDI,Bac+5,10 à 15 ans,Automatisme,Anglais,"Communication, Leadership, Organisation, Proactivité, Rigueur",https://www.dreamjob.ma/emploi/tractafric-lance-un-stage-en-rh-et-un-poste-senior/
Casa Transport ouvre 5 postes stratégiques,Casa Transport,Non spécifié,Logistique,CDD,Bac+5,2 à 3 ans,Non spécifié,Non specifié,Non spécifié,https://www.dreamjob.ma/emploi/casa-transport-ouvre-5-postes-strategiques/
COFICAB ouvre plusieurs postes à Kénitra dès maintenant,COFICAB,Kénitra,Automobile,CDI,Bac+2,1 à 3 ans,SPC,Anglais,Communication,https://www.dreamjob.ma/emploi/coficab-ouvre-plusieurs-postes-a-kenitra-des-maintenant/
TotalEnergies ouvre son programme de recrutement jeunes diplômés,TotalEnergies,Casablanca,"Construction, Énergie",Non spécifié,Bac+5,Non spécifié,Non spécifié,Non specifié,Communication,https://www.dreamjob.ma/emploi/totalenergies-ouvre-son-programme-de-recrutement-jeunes-diplomes/
Nouvelles Opportunités à saisir chez Fujikura à Kénitra,Non spécifié,Kénitra,Automobile,CDI,"Bac+2, bac+5",2 à 5 ans,Non spécifié,Anglais,"Communication, Gestion de projet, Leadership, Rigueur, Réactivité, Résolution de problèmes",https://www.dreamjob.ma/emploi/nouvelles-opportunites-a-saisir-chez-fujikura-a-kenitra/
Nouvelle campagne de recrutement chez Tractafric Equipment,Non spécifié,Non spécifié,"Automobile, Btp, Construction, Logistique, Minier, Énergie",CDI,"Bac+2, bac+5",80 ans,"Excel, SAP",Non specifié,"Autonomie, Communication, Créativité, Leadership, Rigueur",https://www.dreamjob.ma/emploi/nouvelle-campagne-de-recrutement-chez-tractafric-equipment/
2 postes à pourvoir chez Ciments du Maroc à Marrakech,Non spécifié,Marrakech,Construction,CDI,Bac+5,3 à 4 ans,"GMAO, Ms project, SAP","Français, Anglais","Autonomie, Organisation, Rigueur, Travailler en équipe",https://www.dreamjob.ma/emploi/2-postes-a-pourvoir-chez-ciments-du-maroc-a-marrakech/
Opportunités d’emploi dans l’industrie chez Sanipak,Non spécifié,Berrechid,Non spécifié,Non spécifié,Non spécifié,2 ans,Non spécifié,Non specifié,"Organisé, Rigueur, Réactivité, Travailler en équipe",https://www.dreamjob.ma/emploi/opportunites-demploi-dans-lindustrie-chez-sanipak/
Postes à saisir chez Quality Tomato Morocco à Agadir,Non spécifié,Agadir,Non spécifié,Non spécifié,"Bac+2, bac+3, bac+4, bac+5",10 ans,Non spécifié,Non specifié,"Autonome, Organisation",https://www.dreamjob.ma/emploi/postes-a-saisir-chez-quality-tomato-morocco-a-agadir/
EM ÉNERGIE lance une campagne de recrutement multi profils,Non spécifié,Casablanca,Énergie,Non spécifié,"Bac+2, bac+3, bac+5",5 ans,Autocad,Non specifié,"Autonomie, Organisation, Rigueur",https://www.dreamjob.ma/emploi/em-energie-lance-une-campagne-de-recrutement-multi-profils/
Tractafric Equipment Maroc recrute de nombreux profils à Casablanca,Tractafric Equipment Maroc,Casablanca,Non spécifié,Non spécifié,Non spécifié,Non spécifié,Non spécifié,Non specifié,"Rigueur, Travailler en équipe",https://www.dreamjob.ma/emploi/tractafric-equipment-maroc-recrute-de-nombreux-profils-a-casablanca/
Meski Invest recrute 14 postes industriels à travers le Maroc,Meski Invest,Non spécifié,"Automobile, Construction, Logistique, Métallurgie",CDI,"Bac+2, bac+3, bac+5",40 ans,Non spécifié,Non specifié,"Leadership, Organisation, Rigueur",https://www.dreamjob.ma/emploi/meski-invest-recrute-14-postes-industriels-a-travers-le-maroc/
Mint HR recrute un(e) Chargé(e) de Recrutement (CDI) – Casablanca,Mint HR,Casablanca,Non spécifié,CDI,"Bac+3, bac+5",Non spécifié,Non spécifié,Non specifié,"Autonomie, Communication, Organisation, Relationnel, Rigueur",https://www.dreamjob.ma/emploi/mint-hr-recrute-une-chargee-de-recrutement-cdi-casablanca/
Magasin d’Optique recrute une Vendeuse (Wifak Témara),Magasin d’Optique,Témara,Non spécifié,Non spécifié,Non spécifié,Non spécifié,Non spécifié,Non specifié,"Autonome, Communication, Organisation, Organisé, Proactivité, Rigueur, Travailler en équipe",https://www.dreamjob.ma/emploi/optique-recrute-une-vendeuse-sur-wifak-temara/
"Solevio recrute des Vendeurs Conventionnels CHR (Cafés, Hôtels, Restaurants) (Casablanca)",Solevio,Casablanca,Agroalimentaire,Non spécifié,Bac+2,3 ans,Non spécifié,Non specifié,Non spécifié,https://www.dreamjob.ma/emploi/solevio-recrute-vendeurs-conventionnels-chr-casablanca/
Grande campagne de recrutement Calliope: plusieurs postes à saisir partout au Maroc,Non spécifié,Non spécifié,"Automobile, Logistique",Stage,"Bac+2, bac+3, bac+4, bac+5",3 à 5 ans,Excel,"Français, Anglais, Arabe","Autonomie, Communication, Créativité, Gestion de projet, Initiative, Innovation, Leadership, Organisation, Relationnel, Rigueur, Réactivité, Travailler en équipe",https://www.dreamjob.ma/emploi/grande-campagne-de-recrutement-calliope-plusieurs-postes-a-saisir-partout-au-maroc/
Recrutement d’un Responsable des Opérations (Rabat),Non spécifié,Rabat,Non spécifié,CDI,Non spécifié,Non spécifié,Non spécifié,Non specifié,"Organisation, Relationnel, Rigueur",https://www.dreamjob.ma/emploi/recrutement-dun-responsable-des-operations-rabat/
Juriste Junior,Non spécifié,Non spécifié,Non spécifié,CDI,Bac+5,Non spécifié,Non spécifié,"Français, Anglais","Communication, Organisation, Rigueur",https://www.dreamjob.ma/stage/minthr-recrute-juriste-junior-stage-casablanca/
ADM Value agrandit ses équipes à Rabat: découvrez nos offres en télévente et conseil,Non spécifié,Rabat,"Automobile, Énergie",CDI,Non spécifié,20 ans,Non spécifié,Français,"Autonomie, Communication, Organisation, Relationnel, Rigueur, Réactivité",https://www.dreamjob.ma/emploi/adm-value-recrute-plusieurs-profils/
Fondation Arrawaj recrute Plusieurs Profils (Tout le Maroc),Fondation Arrawaj,Non spécifié,Non spécifié,CDI,Bac+3,30 ans,Non spécifié,Non specifié,"Autonomie, Communication, Initiative, Leadership, Organisation, Rigueur",https://www.dreamjob.ma/emploi/fondation-arrawaj-recrute-plusieurs-profils-tout-le-maroc/
Société de Construction Routière recrute un Responsable Matériel BTP à Salé,Société de Construction Routière,Salé,"Btp, Construction, Logistique",Non spécifié,Bac+5,5 ans,Non spécifié,Non specifié,Organisation,https://www.dreamjob.ma/emploi/societe-de-construction-routiere-recrute-un-responsable-materiel-btp-a-sale/
Université Euromed de Fès recrute 16 nouveaux profils,Université Euromed de Fès,Fès,"Chimie, Recherche scientifique",Non spécifié,Non spécifié,Non spécifié,Non spécifié,Non specifié,Innovation,https://www.dreamjob.ma/emploi/universite-euromed-de-fes-recrute-16-nouveaux-profils/
Recrutement de Rédacteurs Web Freelance en Télétravail,Non spécifié,Non spécifié,Non spécifié,Non spécifié,Non spécifié,Non spécifié,Non spécifié,"Français, Anglais",Flexibilité,https://www.dreamjob.ma/emploi/start-up-recrute-des-redacteurs-web-freelance-en-teletravail/
Akkodis ouvre de nombreux postes techniques au Maroc,Akkodis,Non spécifié,Ferroviaire,Non spécifié,Non spécifié,Non spécifié,"ERP, SAP",Non specifié,"Autonomie, Innovation, Rigueur",https://www.dreamjob.ma/emploi/akkodis-ouvre-de-nombreux-postes-techniques-au-maroc/
5 Offres d’emploi industrielles chez Hutchinson Maroc,Non spécifié,Casablanca,"Automobile, Aéronautique, Construction, Ferroviaire, Logistique, Énergie",CDI,"Bac+3, bac+4, bac+5",170 ans,"AMDEC, Automatisme, ERP, PPAP","Français, Anglais","Communication, Innovation",https://www.dreamjob.ma/emploi/5-offres-demploi-industrielles-chez-hutchinson-maroc/
Postes ouverts en maintenance et systèmes d’information chez Mafoder,Non spécifié,Casablanca,Btp,CDI,Non spécifié,2 ans,ERP,Non specifié,"Autonomie, Organisation, Rigueur, Réactivité",https://www.dreamjob.ma/emploi/postes-ouverts-en-maintenance-et-systemes-dinformation-chez-mafoder/
"Bosch Africa ouvre des postes RH, finance et techniques",Bosch Africa,Casablanca,Non spécifié,CDI,Non spécifié,1 à 3 ans,"ERP, SAP","Français, Anglais","Innovation, Organisation",https://www.dreamjob.ma/emploi/bosch-africa-ouvre-des-postes-rh-finance-et-techniques/
Super Auto Group recrute 4 profils clés dans l’automobile,Super Auto Group,Rabat,Automobile,Non spécifié,"Bac+2, bac+3, bac+5",2 ans,Non spécifié,"Français, Anglais","Communication, Leadership, Organisation, Relationnel",https://www.dreamjob.ma/emploi/super-auto-group-recrute-4-profils-cles-dans-lautomobile/
6 Postes à saisir chez TE Connectivity à Tanger,Non spécifié,Tanger,"Automobile, Procédés, Énergie",Non spécifié,Non spécifié,5 à 6 ans,"Lean, Lean manufacturing","Français, Anglais","Autonomie, Innovation, Leadership, Rigueur",https://www.dreamjob.ma/emploi/6-postes-a-saisir-chez-te-connectivity-a-tanger/
INGELEC ouvre 5 nouvelles opportunités à Casablanca,INGELEC,Casablanca,Logistique,CDI,"Bac+2, bac+3, bac+4, bac+5",2 à 5 ans,ERP,Non specifié,"Innovation, Organisation",https://www.dreamjob.ma/emploi/ingelec-ouvre-plusieurs-opportunites-a-casablanca/
6 Postes à saisir chez PROMAN à El Jadida et Youssoufia,Non spécifié,Youssoufia,"Btp, Logistique",Intérim,Non spécifié,2 ans,Non spécifié,Anglais,"Autonomie, Organisation, Rigueur, Réactivité, Travailler en équipe",https://www.dreamjob.ma/emploi/6-postes-a-saisir-chez-proman-a-el-jadida-et-youssoufia/
Stellantis ouvre plusieurs postes pour profils OFPPT,Stellantis,Non spécifié,"Automobile, Construction, Logistique, Plasturgie",Anapec,Non spécifié,Non spécifié,Non spécifié,Non specifié,Rigueur,https://www.dreamjob.ma/emploi/stellantis-ouvre-plusieurs-postes-pour-profils-ofppt/
Nouvelles offres d’emploi chez ZF Lifetec Morocco à saisir,Non spécifié,Non spécifié,"Automobile, Logistique",Non spécifié,Non spécifié,Non spécifié,"Automatisme, ERP","Français, Anglais","Autonomie, Communication, Organisation, Rigueur, Travailler en équipe",https://www.dreamjob.ma/emploi/nouvelles-offres-demploi-chez-zf-lifetec-morocco-a-saisir/
DARI COUSPATE ouvre plusieurs opportunités en CDI,DARI COUSPATE,Salé,Agroalimentaire,CDI,Non spécifié,4 ans,Non spécifié,Non specifié,"Autonomie, Communication, Leadership, Organisation, Rigueur",https://www.dreamjob.ma/emploi/dari-couspate-ouvre-plusieurs-opportunites-en-cdi/
"Opportunités professionnelles à Casablanca, Mafoder Group recrute","Opportunités professionnelles à Casablanca, Mafoder Group",Casablanca,"Btp, Logistique",Non spécifié,Non spécifié,Non spécifié,Non spécifié,Non specifié,"Autonomie, Organisation, Relationnel, Rigueur",https://www.dreamjob.ma/emploi/opportunites-professionnelles-a-casablanca-mafoder-group-recrute/
"Postes industriels à saisir, SOMADIR recrute dès maintenant","Postes industriels à saisir, SOMADIR",Casablanca,Agroalimentaire,CDI,"Bac+3, bac+5",10 ans,Non spécifié,Non specifié,"Leadership, Organisation, Rigueur, Réactivité, Travailler en équipe",https://www.dreamjob.ma/emploi/postes-industriels-a-saisir-somadir-recrute-des-maintenant/
Recrutement chez SAMSIC Maroc en maintenance multitechnique,Non spécifié,Casablanca,Non spécifié,CDI,Bac+2,Non spécifié,GMAO,Non specifié,"Autonomie, Polyvalence, Relationnel, Rigueur, Réactivité, Résolution de problèmes",https://www.dreamjob.ma/emploi/recrutement-chez-samsic-maroc-en-maintenance-multitechnique/
"Recrutement SEBN Bouknadel, responsables et team leaders recherchés",Non spécifié,Non spécifié,Automobile,CDI,Bac+5,5 ans,"Kaizen, Lean, Six sigma",Non specifié,"Communication, Leadership, Organisation, Organisé",https://www.dreamjob.ma/emploi/recrutement-sebn-bouknadel-responsables-et-team-leaders-recherches/
SAM Aviagroup recrute à Nouaceur 5 postes en CDI,SAM Aviagroup,Casablanca,"Aéronautique, Logistique, Procédés",CDI,Bac+5,4 ans,"ERP, Excel",Anglais,"Autonomie, Communication, Leadership, Organisation, Proactivité, Rigueur, Résolution de problèmes",https://www.dreamjob.ma/emploi/sam-aviagroup-recrute-a-nouaceur-5-postes-en-cdi/
