Titre du poste,Entreprise,Ville,Secteur,Contrat proposé,Niveau d'étude,Expérience,Compétences Techniques,Langues,Soft Skills,Lien de l'offre
Inscription Concours EMI Rabat 2025/2026,Non spécifié,Rabat,"Procédés, Recherche scientifique",Non spécifié,Non spécifié,22 ans,Modélisation,Non specifié,Créativité,https://www.dreamjob.ma/orientation/inscription-concours-emi-rabat-2025-2026/
CDI chez EATON: boostez votre carrière dans la gestion de l’énergie,Non spécifié,Non spécifié,"Procédés, Énergie",CDI,"Bac+2, bac+3, bac+5",Non spécifié,"Autocad, SAP, SOLIDWORKS","Français, Anglais",Non spécifié,https://www.dreamjob.ma/emploi/cdi-chez-eaton-boostez-votre-carriere-dans-la-gestion-de-lenergie/
Rejoignez Mundiapolis: 16 postes ouverts pour enseignants et professionnels de santé,Non spécifié,Non spécifié,"Aéronautique, Logistique",Non spécifié,Non spécifié,25 ans,Non spécifié,"Français, Anglais","Communication, Initiative, Innovation",https://www.dreamjob.ma/emploi/rejoignez-mundiapolis-16-postes-ouverts-pour-enseignants-et-professionnels-de-sante/
Rejoignez Martur Fompak à Tanger: poste de technicien pièces de rechange,Non spécifié,Tanger,"Automobile, Logistique",Non spécifié,"Bac+3, bac+5",Non spécifié,Non spécifié,Non specifié,"Innovation, Organisation, Relationnel, Rigueur",https://www.dreamjob.ma/emploi/rejoignez-martur-fompak-a-tanger-poste-de-technicien-pieces-de-rechange/
Résultats Concours ONCF 2025 (380 Techniciens Spécialisés),Non spécifié,Non spécifié,"Construction, Ferroviaire, Logistique",Non spécifié,Bac+2,15 ans,Non spécifié,Non specifié,"Autonomie, Initiative",https://www.dreamjob.ma/emploi-public/resultats-concours-oncf-2025-380-techniciens-specialises/
COFAT Maroc recrute des techniciens maintenance à Kénitra,COFAT Maroc,Kénitra,Automobile,Stage,Bac+2,Non spécifié,Non spécifié,"Français, Anglais","Autonome, Communication, Innovation, Rigueur, Réactivité",https://www.dreamjob.ma/emploi/cofat-maroc-recrute-des-techniciens-maintenance-a-kenitra/
Inscription Concours IFMIA Tanger 2025/2026,Non spécifié,Tanger,Automobile,Non spécifié,Non spécifié,30 ans,Non spécifié,Français,Initiative,https://www.dreamjob.ma/orientation/inscription-concours-ifmia-tanger-2025-2026/
Inscription Concours IFMIA Kénitra 2025/2026,Non spécifié,Kénitra,Automobile,Non spécifié,Non spécifié,30 ans,Non spécifié,Français,"Initiative, Organisation",https://www.dreamjob.ma/orientation/inscription-concours-ifmia-kenitra-2025-2026/
L’UEMF lance une Grande Campagne de Recrutement (+50 Postes),Non spécifié,Fès,"Chimie, Recherche scientifique",Stage,Non spécifié,Non spécifié,Robotique,Non specifié,Innovation,https://www.dreamjob.ma/emploi/luemf-lance-une-grande-campagne-de-recrutement/
Liste des Convoqués Oral Concours de Recrutement ONCF 2025 (170 Postes),Non spécifié,Non spécifié,Ferroviaire,Non spécifié,Bac+3,30 ans,Non spécifié,Non specifié,"Initiative, Innovation, Organisé, Rigueur",https://www.dreamjob.ma/emploi-public/liste-des-convoques-oral-concours-de-recrutement-oncf-2025-170-postes/
Carrière dans l’aéronautique: postulez chez SAM dès maintenant,Non spécifié,Non spécifié,"Aéronautique, Logistique, Procédés",CDI,"Bac+2, bac+3",Non spécifié,CATIA,Non specifié,"Innovation, Relationnel, Rigueur",https://www.dreamjob.ma/emploi/carriere-dans-laeronautique-postulez-chez-sam-des-maintenant/
Inscription Concours IFMIA Casablanca 2025/2026,Non spécifié,Casablanca,Automobile,Non spécifié,Non spécifié,30 ans,Non spécifié,Français,Initiative,https://www.dreamjob.ma/etudiants/inscription-concours-ifmia-casablanca-2025-2026/
Postulez dès maintenant chez Sonasid: 20+ postes ouverts dans divers métiers,Non spécifié,Non spécifié,Logistique,CDI,"Bac+3, bac+4, bac+5",1 à 5 ans,Non spécifié,Non specifié,Non spécifié,https://www.dreamjob.ma/emploi/postulez-des-maintenant-chez-sonasid-20-postes-ouverts-dans-divers-metiers/
Rejoignez SEWS CABIND Maroc en tant que Technicien Maintenance,Non spécifié,Berrechid,Automobile,Non spécifié,Bac+2,Non spécifié,Non spécifié,Non specifié,"Innovation, Rigueur, Résolution de problèmes",https://www.dreamjob.ma/emploi/rejoignez-sews-cabind-maroc-en-tant-que-technicien-maintenance/
Mint HR recrute un(e) Chargé(e) de Recrutement (CDI) – Casablanca,Mint HR,Casablanca,Non spécifié,CDI,"Bac+3, bac+5",Non spécifié,Non spécifié,Non specifié,"Autonomie, Communication, Organisation, Relationnel, Rigueur",https://www.dreamjob.ma/emploi/mint-hr-recrute-une-chargee-de-recrutement-cdi-casablanca/
Magasin d’Optique recrute une Vendeuse (Wifak Témara),Magasin d’Optique,Témara,Non spécifié,Non spécifié,Non spécifié,Non spécifié,Non spécifié,Non specifié,"Autonome, Communication, Organisation, Organisé, Proactivité, Rigueur, Travailler en équipe",https://www.dreamjob.ma/emploi/optique-recrute-une-vendeuse-sur-wifak-temara/
"Solevio recrute des Vendeurs Conventionnels CHR (Cafés, Hôtels, Restaurants) (Casablanca)",Solevio,Casablanca,Agroalimentaire,Non spécifié,Bac+2,3 ans,Non spécifié,Non specifié,Non spécifié,https://www.dreamjob.ma/emploi/solevio-recrute-vendeurs-conventionnels-chr-casablanca/
Grande campagne de recrutement Calliope: plusieurs postes à saisir partout au Maroc,Non spécifié,Non spécifié,"Automobile, Logistique",Stage,"Bac+2, bac+3, bac+4, bac+5",3 à 5 ans,Excel,"Français, Anglais, Arabe","Autonomie, Communication, Créativité, Gestion de projet, Initiative, Innovation, Leadership, Organisation, Relationnel, Rigueur, Réactivité, Travailler en équipe",https://www.dreamjob.ma/emploi/grande-campagne-de-recrutement-calliope-plusieurs-postes-a-saisir-partout-au-maroc/
Recrutement d’un Responsable des Opérations (Rabat),Non spécifié,Rabat,Non spécifié,CDI,Non spécifié,Non spécifié,Non spécifié,Non specifié,"Organisation, Relationnel, Rigueur",https://www.dreamjob.ma/emploi/recrutement-dun-responsable-des-operations-rabat/
Juriste Junior,Non spécifié,Non spécifié,Non spécifié,CDI,Bac+5,Non spécifié,Non spécifié,"Français, Anglais","Communication, Organisation, Rigueur",https://www.dreamjob.ma/stage/minthr-recrute-juriste-junior-stage-casablanca/
ADM Value agrandit ses équipes à Rabat: découvrez nos offres en télévente et conseil,Non spécifié,Rabat,"Automobile, Énergie",CDI,Non spécifié,20 ans,Non spécifié,Français,"Autonomie, Communication, Organisation, Relationnel, Rigueur, Réactivité",https://www.dreamjob.ma/emploi/adm-value-recrute-plusieurs-profils/
Fondation Arrawaj recrute Plusieurs Profils (Tout le Maroc),Fondation Arrawaj,Non spécifié,Non spécifié,CDI,Bac+3,30 ans,Non spécifié,Non specifié,"Autonomie, Communication, Initiative, Leadership, Organisation, Rigueur",https://www.dreamjob.ma/emploi/fondation-arrawaj-recrute-plusieurs-profils-tout-le-maroc/
Société de Construction Routière recrute un Responsable Matériel BTP à Salé,Société de Construction Routière,Salé,"Btp, Construction, Logistique",Non spécifié,Bac+5,5 ans,Non spécifié,Non specifié,Organisation,https://www.dreamjob.ma/emploi/societe-de-construction-routiere-recrute-un-responsable-materiel-btp-a-sale/
Université Euromed de Fès recrute 16 nouveaux profils,Université Euromed de Fès,Fès,"Chimie, Recherche scientifique",Non spécifié,Non spécifié,Non spécifié,Non spécifié,Non specifié,Innovation,https://www.dreamjob.ma/emploi/universite-euromed-de-fes-recrute-16-nouveaux-profils/
Recrutement de Rédacteurs Web Freelance en Télétravail,Non spécifié,Non spécifié,Non spécifié,Non spécifié,Non spécifié,Non spécifié,Non spécifié,"Français, Anglais",Flexibilité,https://www.dreamjob.ma/emploi/start-up-recrute-des-redacteurs-web-freelance-en-teletravail/
Opportunité à Jorf: devenez Chef de Projet chez SIDEN,Non spécifié,Jorf,Construction,Non spécifié,Non spécifié,Non spécifié,Non spécifié,Non specifié,"Autonomie, Gestion de projet, Rigueur",https://www.dreamjob.ma/emploi/opportunite-a-jorf-devenez-chef-de-projet-chez-siden/
"SNEP recrute des profils expérimentés en Supply Chain, Finance et Maintenance",SNEP,Non spécifié,"Agroalimentaire, Automobile, Btp, Logistique",Non spécifié,Non spécifié,50 ans,Non spécifié,Non specifié,"Communication, Innovation",https://www.dreamjob.ma/emploi/snep-recrute-des-profils-experimentes-en-supply-chain-finance-et-maintenance/
Liste des Convoqués Concours de Recrutement ONCF 2025 (170 Postes),Non spécifié,Non spécifié,Ferroviaire,Non spécifié,Bac+3,30 ans,Non spécifié,Non specifié,"Initiative, Innovation, Organisé, Rigueur",https://www.dreamjob.ma/emploi-public/liste-des-convoques-concours-de-recrutement-oncf-2025-170-postes/
SNEP recrute des profils expérimentés – Postulez dès maintenant,SNEP,Mohammedia,"Agroalimentaire, Automobile, Btp, Logistique",Non spécifié,Non spécifié,8 ans,Non spécifié,Non specifié,"Communication, Innovation",https://www.dreamjob.ma/emploi/snep-recrute-des-profils-experimentes-postulez-des-maintenant/
Groupe Dama recrute Plusieurs Profils pour son Client Fluoralpha,Groupe Dama,Non spécifié,"Chimie, Logistique, Procédés",Non spécifié,"Bac+2, bac+3, bac+5",5 à 10 ans,"ERP, SAP","Français, Anglais, Arabe","Communication, Innovation, Leadership, Organisation, Rigueur",https://www.dreamjob.ma/emploi/groupe-dama-recrute-plusieurs-profils-pour-son-client-fluoralpha/
(6) Offres d’emploi et stages PFE chez Saint-Gobain – Postulez dès maintenant,Non spécifié,Non spécifié,"Btp, Chimie, Construction, Procédés",Stage,Bac+5,0 à 2 ans,"ERP, SAP","Français, Anglais","Communication, Organisation, Rigueur",https://www.dreamjob.ma/emploi/6-offres-demploi-et-stages-pfe-chez-saint-gobain-postulez-des-maintenant/
Gestamp recherche des Techniciens Outilleurs pour son site de Kénitra,Non spécifié,Kénitra,Automobile,Stage,Bac+3,Non spécifié,Non spécifié,Non specifié,"Innovation, Rigueur",https://www.dreamjob.ma/emploi/gestamp-recherche-des-techniciens-outilleurs-pour-son-site-de-kenitra/
Emploi en agriculture: Plusieurs postes disponibles chez Pepper World,Non spécifié,Biougra,Agroalimentaire,Non spécifié,Bac+2,Non spécifié,Non spécifié,Non specifié,"Leadership, Organisation, Rigueur, Résolution de problèmes",https://www.dreamjob.ma/emploi/emploi-en-agriculture-plusieurs-postes-disponibles-chez-pepper-world/
JTEKT recrute des Chargés de Méthodes Assemblage à Tanger – Opportunité en CDI,JTEKT,Tanger,Automobile,CDI,Bac+3,3 ans,AMDEC,Non specifié,"Innovation, Leadership, Rigueur",https://www.dreamjob.ma/emploi/jtekt-recrute-des-charges-de-methodes-assemblage-a-tanger-opportunite-en-cdi/
Touax Maroc recrute: plusieurs postes ouverts en 2025,Touax Maroc,Non spécifié,"Btp, Construction, Logistique",Non spécifié,"Bac+2, bac+3, bac+5",5 ans,"DAO, Excel, Lean, Six sigma",Non specifié,Communication,https://www.dreamjob.ma/emploi/touax-maroc-recrute-plusieurs-postes-ouverts-en-2025/
Concours de Recrutement ONCF 2025 (170 Postes),Non spécifié,Non spécifié,Ferroviaire,Non spécifié,Bac+3,30 ans,Non spécifié,Non specifié,"Initiative, Innovation, Organisé, Rigueur",https://www.dreamjob.ma/emploi-public/concours-de-recrutement-oncf-2025-170-postes/
Nestlé recrute: 6 opportunités à pourvoir immédiatement,Nestlé,Non spécifié,"Agroalimentaire, Logistique",Non spécifié,"Bac+2, bac+3",2 ans,"Excel, SAP","Français, Anglais","Autonomie, Communication, Initiative, Innovation, Leadership, Organisation, Relationnel, Rigueur, Réactivité",https://www.dreamjob.ma/emploi/nestle-recrute-6-opportunites-a-pourvoir-immediatement/
SIDEN recrute des Techniciens BE/BM et Préparateurs en construction métallique,SIDEN,Non spécifié,Construction,Non spécifié,Non spécifié,Non spécifié,Non spécifié,Non specifié,Rigueur,https://www.dreamjob.ma/emploi/siden-recrute-des-techniciens-be-bm-et-preparateurs-en-construction-metallique/
Liste des Convoqués Concours ONCF 2025 (380 Techniciens Spécialisés),Non spécifié,Non spécifié,"Construction, Ferroviaire, Logistique",Non spécifié,Bac+2,15 ans,Non spécifié,Non specifié,"Autonomie, Initiative",https://www.dreamjob.ma/emploi-public/liste-des-convoques-concours-oncf-2025-380-techniciens-specialises/
"15 Opportunités de Stages Rémunérés, Pré-Embauche et PFE",Non spécifié,Non spécifié,Automobile,Stage,"Bac+2, bac+3, bac+5",Non spécifié,Excel,Non specifié,Non spécifié,https://www.dreamjob.ma/stage/15-opportunites-de-stages-remuneres-pre-embauche-et-pfe/
Maghreb Industries recrute Plusieurs Profils sur Nouaceur,Maghreb Industries,Nouaceur,"Agroalimentaire, Logistique, Procédés",CDI,"Bac+2, bac+3, bac+4, bac+5",5 ans,"5S, Automatisme, ERP, Excel, Kaizen, Lean, Lean manufacturing","Français, Anglais","Autonomie, Innovation, Leadership, Organisation, Rigueur, Réactivité",https://www.dreamjob.ma/emploi/maghreb-industries-recrute-plusieurs-profils-sur-nouaceur/
STROC Industrie recrute des stagiaires PFE – Postulez maintenant !,STROC Industrie,Had Soualem,Construction,Stage,Bac+4,Non spécifié,Non spécifié,Non specifié,"Créativité, Rigueur, Travailler en équipe",https://www.dreamjob.ma/stage/stroc-industrie-recrute-des-stagiaires-pfe-postulez-maintenant/
Offres de Stages PFE 2025: Rejoignez Coficab et Boostez votre Carrière,Non spécifié,Non spécifié,"Automobile, Logistique",Stage,Non spécifié,Non spécifié,Non spécifié,Non specifié,"Gestion de projet, Innovation",https://www.dreamjob.ma/stage/offres-de-stages-pfe-2025-rejoignez-coficab-et-boostez-votre-carriere/
Concours de Recrutement ONCF 2025 (380 Techniciens Spécialisés),Non spécifié,Non spécifié,"Construction, Ferroviaire, Logistique",Non spécifié,Bac+2,15 ans,Non spécifié,Non specifié,"Autonomie, Initiative",https://www.dreamjob.ma/emploi-public/concours-de-recrutement-oncf-2025-380-techniciens-specialises/
Découvrez les (13) Opportunités de Stages et d’Emploi Offertes par Renault Group,Non spécifié,Casablanca,"Automobile, Logistique",Stage,Bac+5,Non spécifié,Non spécifié,Non specifié,Communication,https://www.dreamjob.ma/emploi/decouvrez-les-13-opportunites-de-stages-et-demploi-offertes-par-renault-group/
Mint HR recrute un(e) Chargé(e) de Recrutement (CDI) – Casablanca,Mint HR,Casablanca,Non spécifié,CDI,"Bac+3, bac+5",Non spécifié,Non spécifié,Non specifié,"Autonomie, Communication, Organisation, Relationnel, Rigueur",https://www.dreamjob.ma/emploi/mint-hr-recrute-une-chargee-de-recrutement-cdi-casablanca/
Magasin d’Optique recrute une Vendeuse (Wifak Témara),Magasin d’Optique,Témara,Non spécifié,Non spécifié,Non spécifié,Non spécifié,Non spécifié,Non specifié,"Autonome, Communication, Organisation, Organisé, Proactivité, Rigueur, Travailler en équipe",https://www.dreamjob.ma/emploi/optique-recrute-une-vendeuse-sur-wifak-temara/
"Solevio recrute des Vendeurs Conventionnels CHR (Cafés, Hôtels, Restaurants) (Casablanca)",Solevio,Casablanca,Agroalimentaire,Non spécifié,Bac+2,3 ans,Non spécifié,Non specifié,Non spécifié,https://www.dreamjob.ma/emploi/solevio-recrute-vendeurs-conventionnels-chr-casablanca/
Grande campagne de recrutement Calliope: plusieurs postes à saisir partout au Maroc,Non spécifié,Non spécifié,"Automobile, Logistique",Stage,"Bac+2, bac+3, bac+4, bac+5",3 à 5 ans,Excel,"Français, Anglais, Arabe","Autonomie, Communication, Créativité, Gestion de projet, Initiative, Innovation, Leadership, Organisation, Relationnel, Rigueur, Réactivité, Travailler en équipe",https://www.dreamjob.ma/emploi/grande-campagne-de-recrutement-calliope-plusieurs-postes-a-saisir-partout-au-maroc/
Recrutement d’un Responsable des Opérations (Rabat),Non spécifié,Rabat,Non spécifié,CDI,Non spécifié,Non spécifié,Non spécifié,Non specifié,"Organisation, Relationnel, Rigueur",https://www.dreamjob.ma/emploi/recrutement-dun-responsable-des-operations-rabat/
Juriste Junior,Non spécifié,Non spécifié,Non spécifié,CDI,Bac+5,Non spécifié,Non spécifié,"Français, Anglais","Communication, Organisation, Rigueur",https://www.dreamjob.ma/stage/minthr-recrute-juriste-junior-stage-casablanca/
ADM Value agrandit ses équipes à Rabat: découvrez nos offres en télévente et conseil,Non spécifié,Rabat,"Automobile, Énergie",CDI,Non spécifié,20 ans,Non spécifié,Français,"Autonomie, Communication, Organisation, Relationnel, Rigueur, Réactivité",https://www.dreamjob.ma/emploi/adm-value-recrute-plusieurs-profils/
Fondation Arrawaj recrute Plusieurs Profils (Tout le Maroc),Fondation Arrawaj,Non spécifié,Non spécifié,CDI,Bac+3,30 ans,Non spécifié,Non specifié,"Autonomie, Communication, Initiative, Leadership, Organisation, Rigueur",https://www.dreamjob.ma/emploi/fondation-arrawaj-recrute-plusieurs-profils-tout-le-maroc/
Société de Construction Routière recrute un Responsable Matériel BTP à Salé,Société de Construction Routière,Salé,"Btp, Construction, Logistique",Non spécifié,Bac+5,5 ans,Non spécifié,Non specifié,Organisation,https://www.dreamjob.ma/emploi/societe-de-construction-routiere-recrute-un-responsable-materiel-btp-a-sale/
Université Euromed de Fès recrute 16 nouveaux profils,Université Euromed de Fès,Fès,"Chimie, Recherche scientifique",Non spécifié,Non spécifié,Non spécifié,Non spécifié,Non specifié,Innovation,https://www.dreamjob.ma/emploi/universite-euromed-de-fes-recrute-16-nouveaux-profils/
Recrutement de Rédacteurs Web Freelance en Télétravail,Non spécifié,Non spécifié,Non spécifié,Non spécifié,Non spécifié,Non spécifié,Non spécifié,"Français, Anglais",Flexibilité,https://www.dreamjob.ma/emploi/start-up-recrute-des-redacteurs-web-freelance-en-teletravail/
(7) Postes à Pourvoir chez SEGULA Technologies,Non spécifié,Tanger,"Automobile, Aéronautique, Ferroviaire, Logistique, Naval, Énergie",Non spécifié,Bac+5,5 ans,"CAO, CATIA, Creo, ERP, Excel","Français, Anglais","Communication, Gestion de projet, Innovation, Organisation, Rigueur",https://www.dreamjob.ma/emploi/7-postes-a-pourvoir-chez-segula-technologies/
Offre d’Emploi: Postes de Techniciens Planificateurs chez SIDEN,Non spécifié,Non spécifié,Construction,Non spécifié,Non spécifié,Non spécifié,Non spécifié,Non specifié,"Créativité, Organisation, Rigueur",https://www.dreamjob.ma/emploi/offre-demploi-postes-de-techniciens-planificateurs-chez-siden/
Découvrez les Nouvelles Opportunités de Carrière chez Stellantis,Non spécifié,Non spécifié,"Automobile, Construction",Non spécifié,Bac+5,8 ans,Non spécifié,Anglais,"Autonome, Communication, Innovation, Organisation, Rigueur, Résolution de problèmes",https://www.dreamjob.ma/emploi/decouvrez-les-nouvelles-opportunites-de-carriere-chez-stellantis/
Nouveaux Postes Disponibles chez Eaton,Non spécifié,Casablanca,"Procédés, Énergie",Non spécifié,"Bac+2, bac+3",5 ans,"AMDEC, SOLIDWORKS",Anglais,"Autonomie, Communication, Créativité, Force de proposition, Organisation",https://www.dreamjob.ma/emploi/nouveaux-postes-disponibles-chez-eaton/
Alten Embauche des Experts en 2D et CAPITAL XC,Non spécifié,Non spécifié,"Automobile, Aéronautique, Ferroviaire, Naval, Énergie",Non spécifié,"Bac+2, bac+5",1 an,Non spécifié,Non specifié,Innovation,https://www.dreamjob.ma/emploi/alten-embauche-des-experts-en-2d-et-capital-xc/
Nouvelle Vague de Postes Ouverts chez SEBN-Ma à Salé et Tanger,Non spécifié,Tanger,"Automobile, Construction",Non spécifié,"Bac+2, bac+3, bac+5",2 ans,"Autocad, Conception mécanique","Français, Anglais","Communication, Initiative, Leadership, Organisation",https://www.dreamjob.ma/emploi/nouvelle-vague-de-postes-ouverts-chez-sebn-ma-a-sale-et-tanger/
Carrière chez Oulmès: Nouveaux Profils Recherchés,Non spécifié,Bouskoura,"Agroalimentaire, Logistique",Non spécifié,Bac+5,5 ans,"ERP, Kaizen, Lean",Non specifié,"Communication, Gestion de projet, Innovation, Résolution de problèmes, Travailler en équipe",https://www.dreamjob.ma/emploi/carriere-chez-oulmes-nouveaux-profils-recherches/
SNEP Ouvre ses Portes à de Nouveaux Talents,SNEP,Mohammedia,"Agroalimentaire, Automobile, Btp",Non spécifié,Non spécifié,3 ans,Non spécifié,Non specifié,Non spécifié,https://www.dreamjob.ma/emploi/snep-ouvre-ses-portes-a-de-nouveaux-talents/
(7) Postes Disponibles chez Eaton,Non spécifié,Casablanca,"Aéronautique, Logistique, Procédés, Énergie",Non spécifié,"Bac+2, bac+3, bac+4",1 à 3 ans,"AMDEC, CAO, CATIA, Conception mécanique, DAO, ERP, Excel, SOLIDWORKS","Français, Anglais","Autonome, Autonomie, Communication, Créativité, Flexibilité, Innovation, Leadership, Organisation, Polyvalence, Relationnel, Rigueur, Résolution de problèmes",https://www.dreamjob.ma/emploi/7-postes-disponibles-chez-eaton/
Stages PFE 2025 chez Stellantis: Opportunités pour les Étudiants,Non spécifié,Kénitra,"Automobile, Logistique",Stage,Non spécifié,Non spécifié,Non spécifié,"Français, Anglais","Autonome, Communication",https://www.dreamjob.ma/stage/stages-pfe-2025-chez-stellantis-opportunites-pour-les-etudiants/
CAC Recrute (13) Nouveaux Profils,CAC,Casablanca,Automobile,Non spécifié,Non spécifié,Non spécifié,Non spécifié,Non specifié,Communication,https://www.dreamjob.ma/emploi/cac-recrute-13-nouveaux-profils/
Inscription Concours Technicien Mécanicien Aéronautique ISMALA 2024,Non spécifié,Non spécifié,"Aéronautique, Construction, Logistique",Non spécifié,Non spécifié,27 ans,"Automatisme, Robotique","Français, Anglais",Non spécifié,https://www.dreamjob.ma/orientation/inscription-concours-technicien-mecanicien-aeronautique-ismala-2024/
Devenez Technicien Maintenance chez Saint Gobain,Non spécifié,Kénitra,"Construction, Énergie",Non spécifié,Non spécifié,3 à 5 ans,5S,"Français, Anglais",Non spécifié,https://www.dreamjob.ma/emploi/devenez-technicien-maintenance-chez-saint-gobain/
Yazaki Ouvre ses Portes à (5) Nouveaux Profils,Yazaki,Tanger,"Automobile, Logistique",Non spécifié,Bac+5,1 an,"APQP, Kaizen, SAP","Français, Anglais","Communication, Leadership, Organisation, Résolution de problèmes",https://www.dreamjob.ma/emploi/yazaki-ouvre-ses-portes-a-5-nouveaux-profils/
Opportunités de Carrière chez Gentis Recruitment,Non spécifié,Casablanca,"Automobile, Aéronautique, Construction, Ferroviaire, Procédés, Énergie",Non spécifié,Non spécifié,6 ans,"Autocad, Ms project",Non specifié,"Communication, Gestion de projet, Leadership",https://www.dreamjob.ma/emploi/opportunites-de-carriere-chez-gentis-recruitment/
NOMAC Recrute: Êtes-Vous Prêt Pour Le Défi ?,NOMAC,Ouarzazate,"Chimie, Énergie",Non spécifié,Non spécifié,5 à 7 ans,"Ms project, SAP","Anglais, Arabe","Communication, Organisation",https://www.dreamjob.ma/emploi/nomac-recrute-etes-vous-pret-pour-le-defi/
Postes de Stage Ouverts chez Gestamp Maroc,Non spécifié,Non spécifié,Non spécifié,Stage,Non spécifié,Non spécifié,"CAO, Conception mécanique, DAO",Non specifié,"Communication, Innovation, Rigueur, Travailler en équipe",https://www.dreamjob.ma/stage/postes-de-stage-ouverts-chez-gestamp-maroc/
Rejoignez Stellantis en Tant que Technicien Maintenance,Non spécifié,Kénitra,"Automobile, Métallurgie",Non spécifié,Bac+2,3 ans,Robotique,Non specifié,Autonome,https://www.dreamjob.ma/emploi/rejoignez-stellantis-en-tant-que-technicien-maintenance/
Gestamp Maroc Recrute des Stagiaires,Gestamp Maroc,Non spécifié,Non spécifié,Non spécifié,Non spécifié,Non spécifié,"CAO, Conception mécanique, DAO",Non specifié,"Communication, Innovation, Rigueur, Travailler en équipe",https://www.dreamjob.ma/stage/gestamp-maroc-recrute-des-stagiaires/
STROC Industrie: Opportunités de carrière en CDI,Non spécifié,Casablanca,Construction,CDI,Bac+5,5 ans,Non spécifié,Non specifié,"Communication, Créativité, Innovation",https://www.dreamjob.ma/emploi/stroc-industrie-opportunites-de-carriere-en-cdi/
Mint HR recrute un(e) Chargé(e) de Recrutement (CDI) – Casablanca,Mint HR,Casablanca,Non spécifié,CDI,"Bac+3, bac+5",Non spécifié,Non spécifié,Non specifié,"Autonomie, Communication, Organisation, Relationnel, Rigueur",https://www.dreamjob.ma/emploi/mint-hr-recrute-une-chargee-de-recrutement-cdi-casablanca/
Magasin d’Optique recrute une Vendeuse (Wifak Témara),Magasin d’Optique,Témara,Non spécifié,Non spécifié,Non spécifié,Non spécifié,Non spécifié,Non specifié,"Autonome, Communication, Organisation, Organisé, Proactivité, Rigueur, Travailler en équipe",https://www.dreamjob.ma/emploi/optique-recrute-une-vendeuse-sur-wifak-temara/
"Solevio recrute des Vendeurs Conventionnels CHR (Cafés, Hôtels, Restaurants) (Casablanca)",Solevio,Casablanca,Agroalimentaire,Non spécifié,Bac+2,3 ans,Non spécifié,Non specifié,Non spécifié,https://www.dreamjob.ma/emploi/solevio-recrute-vendeurs-conventionnels-chr-casablanca/
Grande campagne de recrutement Calliope: plusieurs postes à saisir partout au Maroc,Non spécifié,Non spécifié,"Automobile, Logistique",Stage,"Bac+2, bac+3, bac+4, bac+5",3 à 5 ans,Excel,"Français, Anglais, Arabe","Autonomie, Communication, Créativité, Gestion de projet, Initiative, Innovation, Leadership, Organisation, Relationnel, Rigueur, Réactivité, Travailler en équipe",https://www.dreamjob.ma/emploi/grande-campagne-de-recrutement-calliope-plusieurs-postes-a-saisir-partout-au-maroc/
Recrutement d’un Responsable des Opérations (Rabat),Non spécifié,Rabat,Non spécifié,CDI,Non spécifié,Non spécifié,Non spécifié,Non specifié,"Organisation, Relationnel, Rigueur",https://www.dreamjob.ma/emploi/recrutement-dun-responsable-des-operations-rabat/
