Titre du poste,Entreprise,Ville,Secteur,Contrat proposé,Niveau d'étude,Expérience,Compétences Techniques,Langues,Soft Skills,Lien de l'offre
Grande campagne de recrutement Calliope: plusieurs postes à saisir partout au Maroc,Non spécifié,Non spécifié,"Automobile, Logistique",Stage,"Bac+2, bac+3, bac+4, bac+5",3 à 5 ans,Excel,"Français, Anglais, Arabe","Autonomie, Communication, Créativité, Gestion de projet, Initiative, Innovation, Leadership, Organisation, Relationnel, Rigueur, Réactivité, Travailler en équipe",https://www.dreamjob.ma/emploi/grande-campagne-de-recrutement-calliope-plusieurs-postes-a-saisir-partout-au-maroc/
Recrutement d’un Responsable des Opérations (Rabat),Non spécifié,Rabat,Non spécifié,CDI,Non spécifié,Non spécifié,Non spécifié,Non specifié,"Organisation, Relationnel, Rigueur",https://www.dreamjob.ma/emploi/recrutement-dun-responsable-des-operations-rabat/
Juriste Junior,Non spécifié,Non spécifié,Non spécifié,CDI,Bac+5,Non spécifié,Non spécifié,"Français, Anglais","Communication, Organisation, Rigueur",https://www.dreamjob.ma/stage/minthr-recrute-juriste-junior-stage-casablanca/
ADM Value agrandit ses équipes à Rabat: découvrez nos offres en télévente et conseil,Non spécifié,Rabat,"Automobile, Énergie",CDI,Non spécifié,20 ans,Non spécifié,Français,"Autonomie, Communication, Organisation, Relationnel, Rigueur, Réactivité",https://www.dreamjob.ma/emploi/adm-value-recrute-plusieurs-profils/
Fondation Arrawaj recrute Plusieurs Profils (Tout le Maroc),Fondation Arrawaj,Non spécifié,Non spécifié,CDI,Bac+3,30 ans,Non spécifié,Non specifié,"Autonomie, Communication, Initiative, Leadership, Organisation, Rigueur",https://www.dreamjob.ma/emploi/fondation-arrawaj-recrute-plusieurs-profils-tout-le-maroc/
Société de Construction Routière recrute un Responsable Matériel BTP à Salé,Société de Construction Routière,Salé,"Btp, Construction, Logistique",Non spécifié,Bac+5,5 ans,Non spécifié,Non specifié,Organisation,https://www.dreamjob.ma/emploi/societe-de-construction-routiere-recrute-un-responsable-materiel-btp-a-sale/
Université Euromed de Fès recrute 16 nouveaux profils,Université Euromed de Fès,Fès,"Chimie, Recherche scientifique",Non spécifié,Non spécifié,Non spécifié,Non spécifié,Non specifié,Innovation,https://www.dreamjob.ma/emploi/universite-euromed-de-fes-recrute-16-nouveaux-profils/
Recrutement de Rédacteurs Web Freelance en Télétravail,Non spécifié,Non spécifié,Non spécifié,Non spécifié,Non spécifié,Non spécifié,Non spécifié,"Français, Anglais",Flexibilité,https://www.dreamjob.ma/emploi/start-up-recrute-des-redacteurs-web-freelance-en-teletravail/
(4) Opportunités de Carrière Disponibles chez LGM Group,Non spécifié,Casablanca,"Ferroviaire, Logistique",Non spécifié,Non spécifié,5 ans,AMDEC,"Français, Anglais","Autonomie, Innovation, Rigueur, Travail en équipe",https://www.dreamjob.ma/emploi/4-opportunites-de-carriere-disponibles-chez-lgm-group/
Recrutement d’Opérateurs Maintenance chez SEWS,Non spécifié,Non spécifié,Automobile,Anapec,Bac+2,Non spécifié,Non spécifié,Non specifié,"Autonomie, Communication, Initiative, Innovation, Rigueur, Travailler en équipe",https://www.dreamjob.ma/emploi/recrutement-doperateurs-maintenance-chez-sews/
Postulez chez SYGMA: (12) Opportunités Disponibles,Non spécifié,El Jadida,Énergie,Non spécifié,"Bac+2, bac+3",5 ans,Non spécifié,Non specifié,Non spécifié,https://www.dreamjob.ma/emploi/postulez-chez-sygma-12-opportunites-disponibles/
De Nouvelles Opportunités Disponibles chez Multicerame,Non spécifié,Berrechid,Btp,Non spécifié,"Bac+2, bac+4",3 à 5 ans,Non spécifié,Non specifié,"Communication, Créativité, Organisation, Rigueur, Travailler en équipe",https://www.dreamjob.ma/emploi/de-nouvelles-opportunites-disponibles-chez-multicerame/
(5) Opportunités de Carrière à l’Université Mundiapolis,Non spécifié,Casablanca,Aéronautique,Stage,Non spécifié,25 ans,Non spécifié,"Français, Anglais","Communication, Initiative",https://www.dreamjob.ma/emploi/6-opportunites-de-carriere-a-luniversite-mundiapolis/
Découvrez les (11) Opportunités de Carrière chez Eaton,Non spécifié,Casablanca,Énergie,Non spécifié,Non spécifié,Non spécifié,Non spécifié,Non specifié,Non spécifié,https://www.dreamjob.ma/emploi/decouvrez-les-11-opportunites-de-carriere-chez-eaton/
Découvrez les Dernières Opportunités de Carrière chez TE Connectivity,Non spécifié,Tanger,"Logistique, Énergie",Non spécifié,Non spécifié,5 ans,Non spécifié,"Français, Anglais","Communication, Flexibilité, Gestion de projet, Innovation, Organisation, Travail en équipe",https://www.dreamjob.ma/emploi/decouvrez-les-dernieres-opportunites-de-carriere-chez-te-connectivity/
Carrières Ouvertes chez TotalEnergies Maroc,Non spécifié,Casablanca,"Construction, Logistique, Énergie",Non spécifié,Non spécifié,90 ans,Non spécifié,"Français, Anglais, Arabe","Autonome, Communication, Créativité, Innovation, Leadership, Organisation, Proactivité, Rigueur",https://www.dreamjob.ma/emploi/carrieres-ouvertes-chez-totalenergies-maroc/
(31) Postes à Saisir chez SEGULA Technologies,Non spécifié,Non spécifié,"Automobile, Aéronautique, Ferroviaire, Naval, Énergie",Non spécifié,Non spécifié,Non spécifié,VBA,Non specifié,Innovation,https://www.dreamjob.ma/emploi/31-postes-a-saisir-chez-segula-technologies/
Capgemini Cherche à Intégrer de Nouveaux Talents,Capgemini,Casablanca,"Automobile, Aéronautique, Ferroviaire, Énergie",Non spécifié,Non spécifié,50 ans,CAO,Français,"Autonome, Innovation",https://www.dreamjob.ma/emploi/capgemini-cherche-a-integrer-de-nouveaux-talents/
Concours de Recrutement Collectivités Territoriales 2024 (51 Postes),Non spécifié,Non spécifié,Automobile,Non spécifié,Non spécifié,Non spécifié,Non spécifié,Non specifié,Non spécifié,https://www.dreamjob.ma/emploi-public/concours-de-recrutement-collectivites-territoriales-2024-51-postes/
ALTEN MAROC Recrute (15) Nouveaux Talents,ALTEN MAROC,Non spécifié,"Automobile, Aéronautique, Ferroviaire, Naval, Énergie",Non spécifié,Non spécifié,Non spécifié,Non spécifié,Non specifié,Innovation,https://www.dreamjob.ma/emploi/alten-maroc-recrute-15-nouveaux-talents/
(4) Postes à Pourvoir chez APM Terminals,Non spécifié,Tanger,Logistique,Non spécifié,Non spécifié,9 ans,Lean,Anglais,"Autonomie, Communication, Gestion de projet, Leadership, Travailler en équipe",https://www.dreamjob.ma/emploi/4-postes-a-pourvoir-chez-apm-terminals/
TotalEnergies Maroc Recrute: Saisissez Votre Chance !,TotalEnergies Maroc,Casablanca,"Construction, Logistique, Énergie",Non spécifié,Non spécifié,90 ans,Non spécifié,"Français, Anglais, Arabe","Autonome, Autonomie, Communication, Créativité, Initiative, Innovation, Leadership, Organisation, Rigueur",https://www.dreamjob.ma/emploi/totalenergies-maroc-recrute-saisissez-votre-chance/
Nouvelles Opportunités: Quatre Postes chez ORH Assessment,Non spécifié,Casablanca,Aéronautique,Non spécifié,Bac+5,8 ans,Lean,"Français, Anglais","Autonome, Communication, Innovation, Leadership, Organisation, Proactivité, Rigueur, Résolution de problèmes",https://www.dreamjob.ma/emploi/nouvelles-opportunites-quatre-postes-chez-orh-assessment/
Nouvelles Opportunités chez RATP Dev !,Non spécifié,Casablanca,"Ferroviaire, Logistique",Non spécifié,Non spécifié,Non spécifié,GMAO,"Français, Arabe","Communication, Force de proposition, Leadership, Rigueur, Résolution de problèmes",https://www.dreamjob.ma/emploi/nouvelles-opportunites-chez-ratp-dev/
Air Liquide Recherche de Nouveaux Talents,Non spécifié,Casablanca,"Métallurgie, Procédés",Non spécifié,Bac+5,3 à 5 ans,GMAO,"Français, Anglais, Arabe","Communication, Flexibilité, Organisation, Rigueur, Résolution de problèmes",https://www.dreamjob.ma/emploi/air-liquide-recherche-de-nouveaux-talents/
Continental est à la Recherche de (5) Profils,Non spécifié,Tétouan,"Automobile, Logistique",Anapec,Bac+5,Non spécifié,"5S, SAP, SPC",Non specifié,"Communication, Flexibilité, Innovation, Leadership, Organisation, Organisé, Polyvalence, Travailler en équipe",https://www.dreamjob.ma/emploi/continental-est-a-la-recherche-de-5-profils/
Recrutement Immédiat: Divers Postes à Pourvoir chez Lydec,Non spécifié,Casablanca,"Construction, Procédés",Non spécifié,Bac+3,30 ans,Non spécifié,Non specifié,"Autonome, Autonomie, Communication, Innovation, Organisation, Polyvalence, Relationnel, Rigueur",https://www.dreamjob.ma/emploi/recrutement-immediat-divers-postes-a-pourvoir-chez-lydec/
Talents Recherchés chez JESA OCP !,Non spécifié,Casablanca,Construction,Non spécifié,"Bac+2, bac+4",10 à 15 ans,GMAO,Non specifié,Communication,https://www.dreamjob.ma/emploi/talents-recherches-chez-jesa-ocp/
Mint HR recrute un(e) Chargé(e) de Recrutement (CDI) – Casablanca,Mint HR,Casablanca,Non spécifié,CDI,"Bac+3, bac+5",Non spécifié,Non spécifié,Non specifié,"Autonomie, Communication, Organisation, Relationnel, Rigueur",https://www.dreamjob.ma/emploi/mint-hr-recrute-une-chargee-de-recrutement-cdi-casablanca/
Magasin d’Optique recrute une Vendeuse (Wifak Témara),Magasin d’Optique,Témara,Non spécifié,Non spécifié,Non spécifié,Non spécifié,Non spécifié,Non specifié,"Autonome, Communication, Organisation, Organisé, Proactivité, Rigueur, Travailler en équipe",https://www.dreamjob.ma/emploi/optique-recrute-une-vendeuse-sur-wifak-temara/
"Solevio recrute des Vendeurs Conventionnels CHR (Cafés, Hôtels, Restaurants) (Casablanca)",Solevio,Casablanca,Agroalimentaire,Non spécifié,Bac+2,3 ans,Non spécifié,Non specifié,Non spécifié,https://www.dreamjob.ma/emploi/solevio-recrute-vendeurs-conventionnels-chr-casablanca/
Grande campagne de recrutement Calliope: plusieurs postes à saisir partout au Maroc,Non spécifié,Non spécifié,"Automobile, Logistique",Stage,"Bac+2, bac+3, bac+4, bac+5",3 à 5 ans,Excel,"Français, Anglais, Arabe","Autonomie, Communication, Créativité, Gestion de projet, Initiative, Innovation, Leadership, Organisation, Relationnel, Rigueur, Réactivité, Travailler en équipe",https://www.dreamjob.ma/emploi/grande-campagne-de-recrutement-calliope-plusieurs-postes-a-saisir-partout-au-maroc/
Recrutement d’un Responsable des Opérations (Rabat),Non spécifié,Rabat,Non spécifié,CDI,Non spécifié,Non spécifié,Non spécifié,Non specifié,"Organisation, Relationnel, Rigueur",https://www.dreamjob.ma/emploi/recrutement-dun-responsable-des-operations-rabat/
Juriste Junior,Non spécifié,Non spécifié,Non spécifié,CDI,Bac+5,Non spécifié,Non spécifié,"Français, Anglais","Communication, Organisation, Rigueur",https://www.dreamjob.ma/stage/minthr-recrute-juriste-junior-stage-casablanca/
ADM Value agrandit ses équipes à Rabat: découvrez nos offres en télévente et conseil,Non spécifié,Rabat,"Automobile, Énergie",CDI,Non spécifié,20 ans,Non spécifié,Français,"Autonomie, Communication, Organisation, Relationnel, Rigueur, Réactivité",https://www.dreamjob.ma/emploi/adm-value-recrute-plusieurs-profils/
Fondation Arrawaj recrute Plusieurs Profils (Tout le Maroc),Fondation Arrawaj,Non spécifié,Non spécifié,CDI,Bac+3,30 ans,Non spécifié,Non specifié,"Autonomie, Communication, Initiative, Leadership, Organisation, Rigueur",https://www.dreamjob.ma/emploi/fondation-arrawaj-recrute-plusieurs-profils-tout-le-maroc/
Société de Construction Routière recrute un Responsable Matériel BTP à Salé,Société de Construction Routière,Salé,"Btp, Construction, Logistique",Non spécifié,Bac+5,5 ans,Non spécifié,Non specifié,Organisation,https://www.dreamjob.ma/emploi/societe-de-construction-routiere-recrute-un-responsable-materiel-btp-a-sale/
Université Euromed de Fès recrute 16 nouveaux profils,Université Euromed de Fès,Fès,"Chimie, Recherche scientifique",Non spécifié,Non spécifié,Non spécifié,Non spécifié,Non specifié,Innovation,https://www.dreamjob.ma/emploi/universite-euromed-de-fes-recrute-16-nouveaux-profils/
Recrutement de Rédacteurs Web Freelance en Télétravail,Non spécifié,Non spécifié,Non spécifié,Non spécifié,Non spécifié,Non spécifié,Non spécifié,"Français, Anglais",Flexibilité,https://www.dreamjob.ma/emploi/start-up-recrute-des-redacteurs-web-freelance-en-teletravail/
ALTEN MAROC: De Nouvelles Opportunités Vous Attendent !,Non spécifié,Rabat,"Automobile, Aéronautique, Ferroviaire, Naval, Énergie",Non spécifié,"Bac+2, bac+5",1 à 3 ans,"APQP, CATIA, NX",Anglais,Innovation,https://www.dreamjob.ma/emploi/alten-maroc-de-nouvelles-opportunites-vous-attendent/
Lear Corporation Recrute des Techniciens de Maintenance,Lear Corporation,Non spécifié,Automobile,Non spécifié,Non spécifié,Non spécifié,Automatisme,Non specifié,Organisation,https://www.dreamjob.ma/emploi/lear-corporation-recrute-des-techniciens-de-maintenance/
Concours Casablanca Baia 2024 (8 Postes),Non spécifié,Casablanca,Non spécifié,Non spécifié,Non spécifié,Non spécifié,Non spécifié,Non specifié,Non spécifié,https://www.dreamjob.ma/emploi-public/concours-casablanca-baia-2024-8-postes/
MAFODER Recrute (6) Talents,MAFODER,Casablanca,"Btp, Construction, Métallurgie",Non spécifié,Bac+2,30 ans,Non spécifié,"Français, Anglais, Arabe","Autonome, Autonomie, Communication, Créatif, Gestion de projet, Initiative, Leadership, Organisation, Proactivité, Relationnel, Rigueur, Travailler en équipe",https://www.dreamjob.ma/emploi/mafoder-recrute-6-talents/
Concours Safran Aircraft Engines: Formation Pré-Embauche,Non spécifié,Casablanca,Aéronautique,Non spécifié,Non spécifié,Non spécifié,Non spécifié,Français,Rigueur,https://www.dreamjob.ma/emploi/concours-safran-aircraft-engines-formation-pre-embauche/
Concours Société Rabat Salé Témara Prestations 2024 (11 Postes),Non spécifié,Témara,Non spécifié,Non spécifié,Non spécifié,Non spécifié,Non spécifié,Non specifié,Non spécifié,https://www.dreamjob.ma/emploi-public/concours-societe-rabat-sale-temara-prestations-2024-11-postes/
0 à 1 An d’Expérience ? Expleo vous Attend !,Non spécifié,Kénitra,Automobile,Non spécifié,Bac+5,1 an,Excel,"Français, Anglais","Communication, Flexibilité, Gestion de projet, Innovation, Organisation, Rigueur",https://www.dreamjob.ma/emploi/0-a-1-an-dexperience-expleo-vous-attend/
Airbus Recrute: Postes Disponibles Immédiatement,Airbus,Casablanca,"Aéronautique, Logistique",Non spécifié,"Bac+2, bac+3",5 ans,Non spécifié,Non specifié,Non spécifié,https://www.dreamjob.ma/emploi/airbus-recrute-postes-disponibles-immediatement/
Liste des Convoqués Concours ONDA 2024 (220 Postes),Non spécifié,Non spécifié,"Aéronautique, Logistique",Non spécifié,"Bac+3, bac+5",5 ans,Non spécifié,Non specifié,Non spécifié,https://www.dreamjob.ma/emploi-public/liste-des-convoques-concours-onda-2024-220-postes/
Leoni Recrute: Stages et Emplois Disponibles !,Leoni,Agadir,"Automobile, Construction, Logistique, Énergie",Stage,Non spécifié,1 an,Non spécifié,"Français, Anglais","Autonome, Communication, Innovation",https://www.dreamjob.ma/emploi/leoni-recrute-stages-et-emplois-disponibles/
Découvrez les Opportunités de Carrière chez Maghreb Steel,Non spécifié,Casablanca,Procédés,Stage,Non spécifié,5 ans,Non spécifié,Non specifié,"Autonomie, Communication, Leadership, Organisation, Rigueur, Réactivité, Résolution de problèmes",https://www.dreamjob.ma/emploi/decouvrez-les-opportunites-de-carriere-chez-maghreb-steel/
(10) Opportunités de Carrière chez COFAT,Non spécifié,Kénitra,"Automobile, Énergie",Stage,Non spécifié,2 à 3 ans,Non spécifié,"Français, Anglais",Non spécifié,https://www.dreamjob.ma/emploi/10-opportunites-de-carriere-chez-cofat/
ECP Maroc Recrute: (10) Talents Recherchés,ECP Maroc,Berrechid,Logistique,Non spécifié,"Bac+2, bac+5",70 ans,"Automatisme, GMAO, SAP",Anglais,"Autonome, Autonomie, Communication, Flexibilité, Force de proposition, Organisation, Rigueur, Résolution de problèmes",https://www.dreamjob.ma/emploi/ecp-maroc-recrute-10-talents-recherches/
Immédiatement: (5) Opportunités de Carrière chez Madrex Engineering,Non spécifié,Casablanca,Construction,Stage,Non spécifié,2 à 3 ans,"Modélisation, Python, SAP",Non specifié,"Autonomie, Communication, Initiative, Travailler en équipe",https://www.dreamjob.ma/emploi/immediatement-5-opportunites-de-carriere-chez-madrex-engineering/
HANDS 8 Recrute: (3) Postes pour Débutants Disponibles,HANDS 8,Tanger,Automobile,Non spécifié,Non spécifié,Non spécifié,"CAO, DAO",Non specifié,"Autonome, Communication, Flexibilité, Organisation, Rigueur, Résolution de problèmes, Travailler en équipe",https://www.dreamjob.ma/emploi/hands-8-recrute-3-postes-pour-debutants-disponibles/
Rejoignez Sygma Africa Maroc: (5) Postes Disponibles,Non spécifié,Casablanca,Énergie,Non spécifié,Non spécifié,5 ans,Non spécifié,Non specifié,Non spécifié,https://www.dreamjob.ma/emploi/rejoignez-sygma-africa-maroc-5-postes-disponibles/
Résultats Définitifs Concours RADEEMA 2024 (73 postes),Non spécifié,Marrakech,Procédés,Non spécifié,Bac+5,Non spécifié,Automatisme,Non specifié,Autonome,https://www.dreamjob.ma/emploi-public/resultats-definitifs-concours-radeema-2024-73-postes/
Nouvelle Vague de Recrutement chez Safran: Candidature Ouverte,Non spécifié,Casablanca,"Aéronautique, Logistique",Non spécifié,Non spécifié,Non spécifié,Fabrication additive,Non specifié,"Communication, Innovation",https://www.dreamjob.ma/emploi/nouvelle-vague-de-recrutement-chez-safran-candidature-ouverte/
Le Ministère de l’Education Nationale Annonce les Résultats du BTS 2024,Non spécifié,Non spécifié,Non spécifié,Non spécifié,Non spécifié,Non spécifié,Non spécifié,Non specifié,Non spécifié,https://www.dreamjob.ma/orientation/le-ministere-de-leducation-nationale-annonce-les-resultats-du-bts-2024/
(24) Emplois à Pourvoir chez SEGULA,Non spécifié,Casablanca,"Automobile, Aéronautique, Ferroviaire, Naval, Énergie",Non spécifié,Non spécifié,Non spécifié,VBA,Non specifié,Innovation,https://www.dreamjob.ma/emploi/24-emplois-a-pourvoir-chez-segula/
Mint HR recrute un(e) Chargé(e) de Recrutement (CDI) – Casablanca,Mint HR,Casablanca,Non spécifié,CDI,"Bac+3, bac+5",Non spécifié,Non spécifié,Non specifié,"Autonomie, Communication, Organisation, Relationnel, Rigueur",https://www.dreamjob.ma/emploi/mint-hr-recrute-une-chargee-de-recrutement-cdi-casablanca/
Magasin d’Optique recrute une Vendeuse (Wifak Témara),Magasin d’Optique,Témara,Non spécifié,Non spécifié,Non spécifié,Non spécifié,Non spécifié,Non specifié,"Autonome, Communication, Organisation, Organisé, Proactivité, Rigueur, Travailler en équipe",https://www.dreamjob.ma/emploi/optique-recrute-une-vendeuse-sur-wifak-temara/
"Solevio recrute des Vendeurs Conventionnels CHR (Cafés, Hôtels, Restaurants) (Casablanca)",Solevio,Casablanca,Agroalimentaire,Non spécifié,Bac+2,3 ans,Non spécifié,Non specifié,Non spécifié,https://www.dreamjob.ma/emploi/solevio-recrute-vendeurs-conventionnels-chr-casablanca/
Grande campagne de recrutement Calliope: plusieurs postes à saisir partout au Maroc,Non spécifié,Non spécifié,"Automobile, Logistique",Stage,"Bac+2, bac+3, bac+4, bac+5",3 à 5 ans,Excel,"Français, Anglais, Arabe","Autonomie, Communication, Créativité, Gestion de projet, Initiative, Innovation, Leadership, Organisation, Relationnel, Rigueur, Réactivité, Travailler en équipe",https://www.dreamjob.ma/emploi/grande-campagne-de-recrutement-calliope-plusieurs-postes-a-saisir-partout-au-maroc/
Recrutement d’un Responsable des Opérations (Rabat),Non spécifié,Rabat,Non spécifié,CDI,Non spécifié,Non spécifié,Non spécifié,Non specifié,"Organisation, Relationnel, Rigueur",https://www.dreamjob.ma/emploi/recrutement-dun-responsable-des-operations-rabat/
Juriste Junior,Non spécifié,Non spécifié,Non spécifié,CDI,Bac+5,Non spécifié,Non spécifié,"Français, Anglais","Communication, Organisation, Rigueur",https://www.dreamjob.ma/stage/minthr-recrute-juriste-junior-stage-casablanca/
ADM Value agrandit ses équipes à Rabat: découvrez nos offres en télévente et conseil,Non spécifié,Rabat,"Automobile, Énergie",CDI,Non spécifié,20 ans,Non spécifié,Français,"Autonomie, Communication, Organisation, Relationnel, Rigueur, Réactivité",https://www.dreamjob.ma/emploi/adm-value-recrute-plusieurs-profils/
Fondation Arrawaj recrute Plusieurs Profils (Tout le Maroc),Fondation Arrawaj,Non spécifié,Non spécifié,CDI,Bac+3,30 ans,Non spécifié,Non specifié,"Autonomie, Communication, Initiative, Leadership, Organisation, Rigueur",https://www.dreamjob.ma/emploi/fondation-arrawaj-recrute-plusieurs-profils-tout-le-maroc/
Société de Construction Routière recrute un Responsable Matériel BTP à Salé,Société de Construction Routière,Salé,"Btp, Construction, Logistique",Non spécifié,Bac+5,5 ans,Non spécifié,Non specifié,Organisation,https://www.dreamjob.ma/emploi/societe-de-construction-routiere-recrute-un-responsable-materiel-btp-a-sale/
Université Euromed de Fès recrute 16 nouveaux profils,Université Euromed de Fès,Fès,"Chimie, Recherche scientifique",Non spécifié,Non spécifié,Non spécifié,Non spécifié,Non specifié,Innovation,https://www.dreamjob.ma/emploi/universite-euromed-de-fes-recrute-16-nouveaux-profils/
Recrutement de Rédacteurs Web Freelance en Télétravail,Non spécifié,Non spécifié,Non spécifié,Non spécifié,Non spécifié,Non spécifié,Non spécifié,"Français, Anglais",Flexibilité,https://www.dreamjob.ma/emploi/start-up-recrute-des-redacteurs-web-freelance-en-teletravail/
Rejoignez JESA OCP: De Nouveaux Talents sont Recherchés !,Non spécifié,Non spécifié,"Construction, Minier",Non spécifié,Bac+4,6-8 ans,Non spécifié,Non specifié,"Communication, Gestion de projet, Leadership",https://www.dreamjob.ma/emploi/rejoignez-jesa-ocp-de-nouveaux-talents-sont-recherches/
LeanCAM Engineering Recrute des Technico-Commerciaux au Maroc et en Afrique,LeanCAM Engineering,Non spécifié,"Automobile, Aéronautique, Ferroviaire",Non spécifié,Non spécifié,Non spécifié,"CAO, Conception mécanique",Non specifié,Autonome,https://www.dreamjob.ma/emploi/leancam-engineering-recrute-des-technico-commerciaux-au-maroc-et-en-afrique/
(8) Postes à pourvoir immédiatement chez RATP Dev,Non spécifié,Casablanca,"Ferroviaire, Logistique",Non spécifié,"Bac+2, bac+3",5 ans,GMAO,"Français, Arabe","Communication, Force de proposition, Rigueur",https://www.dreamjob.ma/emploi/8-postes-a-pourvoir-immediatement-chez-ratp-dev/
Rejoignez l’aventure UTAC: (6) Opportunités de Carrière à Saisir,Non spécifié,Oued Zem,Automobile,Non spécifié,Bac+3,3 an,Non spécifié,Anglais,"Autonome, Communication, Gestion de projet",https://www.dreamjob.ma/emploi/rejoignez-laventure-utac-6-opportunites-de-carriere-a-saisir/
"Ciments de l’Atlas: Plus de (7) postes à pourvoir, postulez maintenant !",Non spécifié,Marrakech,"Btp, Construction, Logistique",Non spécifié,"Bac+2, bac+4, bac+5",10 ans,Modélisation,"Français, Anglais","Autonome, Autonomie, Communication, Innovation, Leadership, Organisation, Organisé, Relationnel, Rigueur, Réactivité, Résolution de problèmes",https://www.dreamjob.ma/emploi/ciments-de-latlas-plus-de-7-postes-a-pourvoir-postulez-maintenant/
Intégrez Sepalumic: De nouvelles opportunités vous attendent !,Non spécifié,Non spécifié,"Btp, Logistique",Non spécifié,"Bac+2, bac+3",11 ans,"Automatisme, GMAO, SAP",Français,"Autonome, Autonomie, Communication, Innovation, Leadership, Organisation, Rigueur, Résolution de problèmes",https://www.dreamjob.ma/emploi/integrez-sepalumic-de-nouvelles-opportunites-vous-attendent/
Rejoignez MAFODER: 5 talents recherchés !,Non spécifié,Casablanca,"Btp, Construction, Métallurgie",Non spécifié,Bac+2,30 ans,Non spécifié,"Français, Anglais, Arabe","Autonome, Autonomie, Communication, Créatif, Gestion de projet, Initiative, Leadership, Organisation, Proactivité, Rigueur, Travailler en équipe",https://www.dreamjob.ma/emploi/rejoignez-mafoder-5-talents-recherches/
Rejoignez JESA OCP en tant que Superviseur Maintenance à Jorf Lasfar et Safi,Non spécifié,Jorf Lasfar,Construction,Non spécifié,Bac+2,5 à 10 ans,Non spécifié,Non specifié,Non spécifié,https://www.dreamjob.ma/emploi/rejoignez-jesa-ocp-en-tant-que-superviseur-maintenance-a-jorf-lasfar-et-safi/
Devenez Formateur en Electrotechnique à IFMIA,Non spécifié,Kénitra,Automobile,Non spécifié,Non spécifié,Non spécifié,Robotique,Non specifié,"Autonomie, Communication, Initiative, Relationnel, Réactivité",https://www.dreamjob.ma/emploi/devenez-formateur-en-electrotechnique-a-ifmia/
Liste des Convoqués Oral Concours ONDA 2024 (220 Postes),Non spécifié,Non spécifié,"Aéronautique, Logistique",Non spécifié,"Bac+3, bac+5",5 ans,Non spécifié,Non specifié,Non spécifié,https://www.dreamjob.ma/emploi-public/liste-des-convoques-oral-concours-onda-2024-220-postes/
Liste des Convoqués Oral Concours RADEEMA 2024 (73 postes),Non spécifié,Marrakech,Procédés,Non spécifié,Bac+5,Non spécifié,Automatisme,Non specifié,Autonome,https://www.dreamjob.ma/emploi-public/liste-des-convoques-oral-concours-radeema-2024-73-postes/
Rejoignez EMB ! De Nombreux Postes sont à Pourvoir,Non spécifié,Rabat,Construction,Non spécifié,Bac+2,40 ans,Non spécifié,Non specifié,Rigueur,https://www.dreamjob.ma/emploi/rejoignez-emb-de-nombreux-postes-sont-a-pourvoir/
